dataset,role_in_study,source_or_doi,source_url,license_or_access,raw_redistributed,notes
Zhang et al. 2022 RC beam database,canonical steel RC beam benchmark,10.1007/s00366-020-01076-x,https://doi.org/10.1007/s00366-020-01076-x,Journal/supplement terms apply,no,Used through locally retrieved supplementary data; raw row-level file is not included.
Sheffield ORDA FRP beam database,FRP slender-beam out-of-envelope benchmark,10.15131/shef.data.5057527,https://orda.shef.ac.uk/articles/dataset/Shear_database_of_RC_FRP_beams_without_shear_reinforcement/5057527,CC BY-NC 4.0,no,Use original ORDA/Figshare record for raw data.
Megahed 2024 RC deep-beam data,steel deep-beam out-of-envelope benchmark,10.1038/s41598-024-64386-w,https://github.com/kmegahed/Deep-beam-ML-models,Repository/data license must be checked at source,no,The article is cited by DOI; the GitHub data are not redistributed here.
Lantsoght 2019 SFRC database,SFRC beam out-of-envelope benchmark,10.5281/zenodo.2578061,https://zenodo.org/records/2578061,CC BY 4.0,no,Use original Zenodo record for raw data.
Avgin et al. 2026 refined RC column database,RC column generalisation benchmark,10.1061/JSENDH.STENG-14725,https://doi.org/10.1061/JSENDH.STENG-14725,Journal/supplement terms apply,no,Used for column capacity and axial-load extrapolation analysis.
ACI369 / PEER / UW column records,column provenance and waveform/source material,source-specific public records,https://nisee.berkeley.edu/spd/,Source-specific terms apply,no,Raw archives and per-specimen text files are not included.
ACI 318 and ACI 440 provisions,mechanical fallback definitions,official standards pages,https://www.concrete.org/store/,Commercial standards,no,Constants/procedures implemented in code; standards text is not redistributed.
JCSS Probabilistic Model Code,load/reliability modelling reference,official model-code page,https://www.jcss-lc.org/jcss-probabilistic-model-code/,Official web source,no,Used as reliability-model source reference.
